{
  "key": "changelog",
  "title": "Changelog",
  "sourceKey": "sotg",
  "contentSet": "core",
  "chapterNumber": 99,
  "readingGroup": "Reference",
  "order": 13,
  "body": "# Changelog\n\n### 3/16/2021\nThere is no changelog, since almost the entirety of the book has been updated in some fashion.\n\n### 11/26/2019\n\n#### Throughout\n- Removed all references to book \"parts\", instead referring to the proper chapters.\n\n#### Chapter 1\n- Corrected Skillful Gunner to Precision Gunner when choosing Han's venture.\n\n#### Chapter 2\n- Added clarification to all of the Versatile deployment features.\n- Corrected System Disruption to apply to saving throws, not damage rolls.\n\n#### Chapter 3\n- Gargantuan Tier 2 Command Ship feature changed Scanned to Tractor Beam\n- Large Tier 2 Concentrated Fire adjusted to align with saving throws instead of attack rolls.\n- Medium Tier 4 Adaptive Armor corrected to actually be a good thing.\n- New roles have been added to each ship size except for Tiny.\n- Gargantuan Blockade Ship Role Mastery adjusted to not require the second tier feature.\n\n#### Chapter 4\n- You can now have more than 10 of any single suite. Don't ask.\n- Gravity Well Projector adjusted.\n- Tier requirement of Backup Hyperdrive removed.\n- Direct Controller damage component removed.\n- Explosive Payload changed to align with the change to ship weapon damage rolls.\n- Removed penalties from the Crew Slot modifications.\n\n#### Chapter 6\n- Storming Gunner changed to align with the change to ship weapon damage rolls.\n- Precision Gunner changed to align with the change to ship weapon damage rolls.\n\n#### Chapter 7\n- Removed the \"if your turning speed would be reduced to less than 50 feet instead increases your speed\" from Dexterity. This will still apply to features.\n- Adjusted ship weapons to use Strength for their damage modifier, instead of Dexterity.\n\n#### Chapter 9\n- Adjusted ship weapons to use Strength for their damage modifier, instead of Dexterity.\n\n#### And, as always\n- Minor text fixes.\n\n### 6/25/2019\n\n#### Chapter 4\n- Changed size adjustment for ships to constructs from three to four.\n- New Engineering System: External Docking System.\n\n#### Chapter 9\n- Added some clarification to Destruction saving throws.\n\n#### And, as always\n- Minor text fixes.\n\n### 5/14/2019\n\n#### Chapter 3\n- Adjusted the ability score maximums for ships, determined by their size.\n\n#### Chapter 4\n- Added clarification for what happens when you cap out an ability score.\n- Added rules for removing a ship's tier.\n\n#### And, as always\n- Minor text fixes.\n\n### 4/2/2019\n\n#### Chapter 4\n- New operation system: secondary transponder code.\n- New suite system: droid storage\n\n#### Chapter 9\n- Clarified that the weapon save DC is also used to calculate for primary and secondary weapons on Large and larger ships.\n\n### 3/5/2019\n\n#### Chapter 3\n- Droid Brain added to Stock Modifications for Tiny ships.\n- The free modifications granted to ships at tier 0 relabeled \"Stock Modifications\".\n\n#### Chapter 4\n- Added proficiency caveats to system types.\n- New engineering system: nano-droid distributor.\n- New operation system: shield disruptor.\n- New suite system: slave pens.\n- New universal system: ejection pod.\n- Proficiency chip series replaced with droid brain.\n- Updates to central computer series of universal systems.\n- Some modifications reworked.\n\n#### Chapter 6\n- Added a clarification regarding forgoing proficiency bonus and expertise.\n\n#### Chapter 8\n- Added more description to deployment capacities for ships.\n\n#### Chapter 9\n- Help action relabeled to Direct, since the action has been changed from the ground game.\n\n### 2/26/2019\n\n#### Throughout\n- Page numbers are now locked in. That means, while the content of a few pages will change, the overall structure of the book won't going forward.\n- You will see a number of pages that are blank. This is deliberate, as a part of the locked in pages.\n\n#### Chapter 2\n- Some features shuffled around. A few rewritten.\n\n#### Chapter 3\n- Some features shuffled around. A few rewritten.\n- New Variant for Space Stations on page 34.\n\n#### Chapter 4\n- Lots of new and rebalanced modifications.\n\n#### Chapter 5\n- Removed the cost disparity for Huge Weapons. The math now follows the same for all other equipment.\n- Changed Primary Weapons on Large and larger ships to use Dex saving throws.\n\n#### Chapter 6\n- Ventures have been smoothed out.\n\n#### Chapter 7\n- Clarified that Turning Speed can not be less than 50 feet.\n\n#### Chapter 8\n- Added rules for Landing Gear\n\n#### Chapter 9\n- Some features rebalanced or reworded.\n\n#### Chapter 10\n- This chapter is still incomplete. The math for encounter building needs to be reverse engineered from ship statblocks.\n\n#### Appendix B\n- This appendix will feature sample starships, one for each size, with additional explanations about how some numbers are derived.\n\n### 2/19/2019\n\n#### Affected Pages\n- A shit load\n- You're still going to see \"found on page \\_\\_\\_\". Page numbers aren't finalized yet so I haven't completed these.\n\n#### Chapter 2\n- Expanded Ventures to one each level instead of every other.\n- Shuffled some features around and added new ones.\n- More memes\n\n#### Chapter 3\n- Took out the Stock Starships, which will go to the Starship appendix for statblocks when ready.\n- Added a page for Tiny starships for those who wanted one.\n- Updated the Tier 0 Starship Features to include free Tier 0 Modifications (discussed in chapter 4)\n- Added some (but not all) flavor.\n\n#### Chapter 4\n- Added rules to change Saving Throws if players wanted to, as well as free tier 0 modifications when constructing brand new ships.\n- Lots of new and reworked modifications.\n- Cantina modification split into Recreation and Mess Hall (since I know people are going to ask where it went).\n\n#### Chapter 5\n- New Quaternary Ammunition: EMP Bomb\n- Added two more hyperdrive classes\n- Added rules for Primary Systems (electricity and life support)\n\n#### Chapter 6\n- Moved Gunning Style/Masteries here.\n- Lots of new ventures, and lots of space/requests for recommendations.\n\n#### Chapter 8\n- Added rules for Movement in Zero Gravity\n- Clarifed the \"deployed\" keyword\n- Moved System Damage to the Conditions appendix and changed it to be an analogue for Exhaustion mechanics\n- Added rules for repairing Primiary Systems and the \"Used\" condition\n\n#### Chapter 9\n- New Pilot action: Evade\n- Adjusted the Patch action\n- Changed Destruction saving throws to implement the new System Damage condition\n\n#### Appendix A\n- I realize the page number is wrong\n- New conditions"
}
